{
  "lifecycleLeasePolicyId": "lifecycleleasepolicy-001",
  "generatedAt": "2026-06-04T23:55:00Z",
  "policyStatus": "lifecycle_operation_lease_policy_checked",
  "decisionStatus": "strict_leases_for_race_prone_writes_idempotency_for_append_only_receipts",
  "normalChecksAcquireLeases": false,
  "allEffectfulOperationsRequireIdempotency": true,
  "sourceBinding": {
    "sourceSurface": "lifecycle_operation_store",
    "sourceCommand": "python3 scripts/ope.py lifecycle-operation-store",
    "sourceStoreStatus": "local_sqlite_runtime_checked",
    "sourceLeaseModelTable": "operation_leases",
    "sourceIdempotencyModelTable": "operation_idempotency_keys"
  },
  "operationPolicies": [
    {
      "operationName": "campaign.create_run",
      "operationClass": "create",
      "lifecyclePhase": "planning",
      "guardMode": "strict_lease",
      "policyReason": "prevents_duplicate_due_run_selection_across_agents",
      "preflightRequired": true,
      "idempotencyKeyRequired": true,
      "leaseRequired": true,
      "operationReceiptRequired": true,
      "normalChecksAcquireLease": false,
      "leaseKeyTemplate": "campaign.create_run:{campaignId}:{runId}",
      "blockedConflictStatus": "blocked_lease_conflict",
      "staleRecoveryAction": "inspect_failed_operations_or_recover_stale_lease",
      "allowedWriteMode": "insert_once",
      "deleteReplacement": "not_delete",
      "rawCrudExposed": false,
      "qualityClaimAllowed": false
    },
    {
      "operationName": "forecast.create",
      "operationClass": "create",
      "lifecyclePhase": "forecasting",
      "guardMode": "strict_lease",
      "policyReason": "prevents_duplicate_forecast_artifact_creation",
      "preflightRequired": true,
      "idempotencyKeyRequired": true,
      "leaseRequired": true,
      "operationReceiptRequired": true,
      "normalChecksAcquireLease": false,
      "leaseKeyTemplate": "forecast.create:{forecastId}",
      "blockedConflictStatus": "blocked_lease_conflict",
      "staleRecoveryAction": "inspect_failed_operations_or_recover_stale_lease",
      "allowedWriteMode": "insert_once",
      "deleteReplacement": "not_delete",
      "rawCrudExposed": false,
      "qualityClaimAllowed": false
    },
    {
      "operationName": "forecast.recalculate",
      "operationClass": "append_update",
      "lifecyclePhase": "recalculation",
      "guardMode": "idempotency_only",
      "policyReason": "append_history_entries_are_idempotent_by_source_hash",
      "preflightRequired": true,
      "idempotencyKeyRequired": true,
      "leaseRequired": false,
      "operationReceiptRequired": true,
      "normalChecksAcquireLease": false,
      "leaseKeyTemplate": "none",
      "blockedConflictStatus": "return_existing_receipt_or_block_mismatch",
      "staleRecoveryAction": "not_applicable",
      "allowedWriteMode": "append_only",
      "deleteReplacement": "not_delete",
      "rawCrudExposed": false,
      "qualityClaimAllowed": false
    },
    {
      "operationName": "question.cancel",
      "operationClass": "terminal_state",
      "lifecyclePhase": "governance",
      "guardMode": "idempotency_only",
      "policyReason": "terminal_state_append_is_guarded_by_preflight_and_idempotency",
      "preflightRequired": true,
      "idempotencyKeyRequired": true,
      "leaseRequired": false,
      "operationReceiptRequired": true,
      "normalChecksAcquireLease": false,
      "leaseKeyTemplate": "none",
      "blockedConflictStatus": "return_existing_receipt_or_block_mismatch",
      "staleRecoveryAction": "not_applicable",
      "allowedWriteMode": "append_only",
      "deleteReplacement": "not_delete",
      "rawCrudExposed": false,
      "qualityClaimAllowed": false
    },
    {
      "operationName": "question.annul",
      "operationClass": "terminal_state",
      "lifecyclePhase": "governance",
      "guardMode": "idempotency_only",
      "policyReason": "annulment_append_is_guarded_by_preflight_and_idempotency",
      "preflightRequired": true,
      "idempotencyKeyRequired": true,
      "leaseRequired": false,
      "operationReceiptRequired": true,
      "normalChecksAcquireLease": false,
      "leaseKeyTemplate": "none",
      "blockedConflictStatus": "return_existing_receipt_or_block_mismatch",
      "staleRecoveryAction": "not_applicable",
      "allowedWriteMode": "append_only",
      "deleteReplacement": "not_delete",
      "rawCrudExposed": false,
      "qualityClaimAllowed": false
    },
    {
      "operationName": "resolution.record",
      "operationClass": "create",
      "lifecyclePhase": "resolution",
      "guardMode": "strict_lease",
      "policyReason": "prevents_double_resolution_for_same_forecast",
      "preflightRequired": true,
      "idempotencyKeyRequired": true,
      "leaseRequired": true,
      "operationReceiptRequired": true,
      "normalChecksAcquireLease": false,
      "leaseKeyTemplate": "resolution.record:{forecastId}",
      "blockedConflictStatus": "blocked_lease_conflict",
      "staleRecoveryAction": "inspect_failed_operations_or_recover_stale_lease",
      "allowedWriteMode": "insert_once",
      "deleteReplacement": "not_delete",
      "rawCrudExposed": false,
      "qualityClaimAllowed": false
    },
    {
      "operationName": "score.create",
      "operationClass": "create",
      "lifecyclePhase": "scoring",
      "guardMode": "strict_lease",
      "policyReason": "prevents_double_scoring_for_same_resolution",
      "preflightRequired": true,
      "idempotencyKeyRequired": true,
      "leaseRequired": true,
      "operationReceiptRequired": true,
      "normalChecksAcquireLease": false,
      "leaseKeyTemplate": "score.create:{forecastId}:{resolutionId}",
      "blockedConflictStatus": "blocked_lease_conflict",
      "staleRecoveryAction": "inspect_failed_operations_or_recover_stale_lease",
      "allowedWriteMode": "insert_once",
      "deleteReplacement": "not_delete",
      "rawCrudExposed": false,
      "qualityClaimAllowed": false
    },
    {
      "operationName": "evidence.append",
      "operationClass": "append_update",
      "lifecyclePhase": "evidence",
      "guardMode": "strict_lease",
      "policyReason": "prevents_duplicate_ledger_append_and_threshold_race",
      "preflightRequired": true,
      "idempotencyKeyRequired": true,
      "leaseRequired": true,
      "operationReceiptRequired": true,
      "normalChecksAcquireLease": false,
      "leaseKeyTemplate": "evidence.append:{campaignId}:{ledgerRowId}",
      "blockedConflictStatus": "blocked_lease_conflict",
      "staleRecoveryAction": "inspect_failed_operations_or_recover_stale_lease",
      "allowedWriteMode": "append_only",
      "deleteReplacement": "not_delete",
      "rawCrudExposed": false,
      "qualityClaimAllowed": false
    },
    {
      "operationName": "pre_calibration.bind",
      "operationClass": "method_state",
      "lifecyclePhase": "method_update",
      "guardMode": "strict_lease",
      "policyReason": "prevents_conflicting_pre_calibration_binding",
      "preflightRequired": true,
      "idempotencyKeyRequired": true,
      "leaseRequired": true,
      "operationReceiptRequired": true,
      "normalChecksAcquireLease": false,
      "leaseKeyTemplate": "pre_calibration.bind:{campaignId}",
      "blockedConflictStatus": "blocked_lease_conflict",
      "staleRecoveryAction": "inspect_failed_operations_or_recover_stale_lease",
      "allowedWriteMode": "prospective_binding",
      "deleteReplacement": "not_delete",
      "rawCrudExposed": false,
      "qualityClaimAllowed": false
    },
    {
      "operationName": "method.apply",
      "operationClass": "method_state",
      "lifecyclePhase": "method_update",
      "guardMode": "strict_lease",
      "policyReason": "prevents_conflicting_method_binding",
      "preflightRequired": true,
      "idempotencyKeyRequired": true,
      "leaseRequired": true,
      "operationReceiptRequired": true,
      "normalChecksAcquireLease": false,
      "leaseKeyTemplate": "method.apply:{campaignId}:{methodBindingId}",
      "blockedConflictStatus": "blocked_lease_conflict",
      "staleRecoveryAction": "inspect_failed_operations_or_recover_stale_lease",
      "allowedWriteMode": "prospective_binding",
      "deleteReplacement": "not_delete",
      "rawCrudExposed": false,
      "qualityClaimAllowed": false
    },
    {
      "operationName": "method.rollback",
      "operationClass": "method_state",
      "lifecyclePhase": "method_update",
      "guardMode": "strict_lease",
      "policyReason": "prevents_conflicting_method_rollback",
      "preflightRequired": true,
      "idempotencyKeyRequired": true,
      "leaseRequired": true,
      "operationReceiptRequired": true,
      "normalChecksAcquireLease": false,
      "leaseKeyTemplate": "method.rollback:{campaignId}:{rollbackId}",
      "blockedConflictStatus": "blocked_lease_conflict",
      "staleRecoveryAction": "inspect_failed_operations_or_recover_stale_lease",
      "allowedWriteMode": "prospective_binding",
      "deleteReplacement": "not_delete",
      "rawCrudExposed": false,
      "qualityClaimAllowed": false
    },
    {
      "operationName": "state.import_json",
      "operationClass": "migration",
      "lifecyclePhase": "migration",
      "guardMode": "strict_lease",
      "policyReason": "prevents_concurrent_state_import_and_hash_mismatch",
      "preflightRequired": true,
      "idempotencyKeyRequired": true,
      "leaseRequired": true,
      "operationReceiptRequired": true,
      "normalChecksAcquireLease": false,
      "leaseKeyTemplate": "state.import_json:{workspaceId}:{sourceStateHash}",
      "blockedConflictStatus": "blocked_lease_conflict",
      "staleRecoveryAction": "inspect_failed_operations_or_recover_stale_lease",
      "allowedWriteMode": "insert_once",
      "deleteReplacement": "not_delete",
      "rawCrudExposed": false,
      "qualityClaimAllowed": false
    },
    {
      "operationName": "record.archive",
      "operationClass": "delete_replacement",